{
  "when": "2025-08-26",
  "where": "Domicile",
  "people_present": [],
  "what_happened": "Geste non désiré perçu comme intrusif.",
  "usual_habits": "Parfois gestes ludiques, rarement discutés explicitement.",
  "boundaries_said": "J'avais dit ne pas aimer ce geste.",
  "safety_risk": "Pas de risque immédiat, mais malaise persistant.",
  "goals": [
    "poser un cadre",
    "discuter à froid",
    "éventuellement consulter un pro"
  ],
  "notes": "Besoin d'y voir clair avant toute décision."
}